{
  "title": "Pressluft hebt einen Lift",
  "note": "aus den Aufgabenblättern (W2 Wärmemaschinen, Nr. 8)",
  "language": "GER",
  "type": 0,
  "default_difficulty": 3,
  "default_points": 0,
  "tags": [
    "entropie",
    "isotherme expansion",
    "zweiter hauptsatz"
  ],
  "subbranches": [
    "Laws of Thermodynamics"
  ],
  "youtube": ""
}