{
  "id": 24894,
  "title": "Drehwinkel eines Plattentellers",
  "note": "aus den Aufgabenblättern (K5 Kreisbewegung, Nr. 4)",
  "language": "GER",
  "type": 1,
  "default_difficulty": 1,
  "default_points": 0,
  "tags": [
    "bogenmass",
    "drehwinkel",
    "kreisbewegung",
    "winkelgeschwindigkeit"
  ],
  "subbranches": [
    "Circular Motion"
  ],
  "youtube": ""
}