{
  "id": 25176,
  "title": "Vor und zurück",
  "note": "aus learningphysics.ch (Lernziel area)",
  "language": "GER",
  "type": 2,
  "default_difficulty": 2,
  "default_points": 0,
  "tags": [
    "fläche",
    "learningphysics",
    "ortsänderung",
    "v-t-diagramm",
    "zurückgelegte strecke"
  ],
  "subbranches": [
    "Kinematics"
  ],
  "youtube": ""
}
