{
  "title": "Eiswürfel in Cola",
  "note": "aus den Aufgabenblättern (W3 Spezifische und latente Wärme, Nr. 11)",
  "language": "GER",
  "type": 1,
  "default_difficulty": 3,
  "default_points": 0,
  "tags": [
    "eis",
    "latente wärme",
    "mischtemperatur",
    "schmelzwärme"
  ],
  "subbranches": [
    "Temperatur & Heat"
  ],
  "youtube": ""
}