{
  "title": "Umlaufzeit und Frequenz eines Velorads",
  "note": "aus den Aufgabenblättern (K5 Kreisbewegung, Nr. 2)",
  "language": "GER",
  "type": 1,
  "default_difficulty": 1,
  "default_points": 0,
  "tags": [
    "frequenz",
    "kinematik",
    "kreisbewegung",
    "umlaufzeit"
  ],
  "subbranches": [
    "Circular Motion"
  ],
  "youtube": ""
}