{
  "title": "Kiste auf einer Rampe",
  "note": "aus den Aufgabenblättern (D5 Kräfte am Hang, Nr. 2; D4 Hangkräfte, Nr. 2; D3 Kräfte 1, Nr. 9)",
  "language": "GER",
  "type": 1,
  "default_difficulty": 2,
  "default_points": 0,
  "tags": [
    "dynamik",
    "gewichtskraft",
    "kraftzerlegung",
    "schiefe ebene"
  ],
  "subbranches": [
    "Dynamics"
  ],
  "youtube": ""
}