{
  "id": 24761,
  "title": "Metallklotz auf Tischplatte",
  "note": "aus den Aufgabenblättern (D4 Normal- & Reibungskraft, Nr. 9; D5KS Reibung und Luftwiderstand, Nr. 1; D5 Reibung und Luftwiderstand, Nr. 1; D5a Reibung, Nr. 2)",
  "language": "GER",
  "type": 1,
  "default_difficulty": 1,
  "default_points": 0,
  "tags": [
    "dynamik",
    "gleitreibung",
    "normalkraft",
    "reibungszahl"
  ],
  "subbranches": [
    "Dynamics"
  ],
  "youtube": ""
}