{
  "id": 24770,
  "title": "Bremsspur im Schneematsch",
  "note": "aus den Aufgabenblättern (D4 Reibung und Luftwiderstand, Nr. 4; D4a Reibung und Luftwiderstand, Nr. 4)",
  "language": "GER",
  "type": 1,
  "default_difficulty": 3,
  "default_points": 0,
  "tags": [
    "bremsweg",
    "dynamik",
    "formelsammlung",
    "gleitreibung",
    "haftreibung"
  ],
  "subbranches": [
    "Dynamics"
  ],
  "youtube": ""
}