{
  "title": "Kugel prallt zurück",
  "note": "aus den Aufgabenblättern (D2 Impuls, Nr. 6; D1 Masse, Dichte & Impuls, Nr. 9; D2 Impuls (2007), Nr. 6)",
  "language": "GER",
  "type": 7,
  "default_difficulty": 2,
  "default_points": 0,
  "tags": [
    "impuls",
    "impulserhaltung",
    "stoss"
  ],
  "subbranches": [
    "Momentum"
  ],
  "youtube": ""
}