{
  "title": "Verschlossene Flasche auf dem Berg",
  "note": "aus den Aufgabenblättern (G1 Gasgesetze, Nr. 14)",
  "language": "GER",
  "type": 1,
  "default_difficulty": 2,
  "default_points": 0,
  "tags": [
    "allgemeine gasgleichung",
    "gasgesetze",
    "luftdruck"
  ],
  "subbranches": [
    "Gas Laws"
  ],
  "youtube": ""
}