{
  "title": "Wasser in heisser Gusseisenpfanne",
  "note": "aus den Aufgabenblättern (W3 Spezifische und latente Wärme, Nr. 7; W3 Spezifische und latente Wärme (2007), Nr. 6)",
  "language": "GER",
  "type": 1,
  "default_difficulty": 2,
  "default_points": 0,
  "tags": [
    "kalorimetrie",
    "mischtemperatur",
    "spezifische wärme",
    "wärme"
  ],
  "subbranches": [
    "Temperatur & Heat"
  ],
  "youtube": ""
}