{
  "title": "Spezifische Wärmen nach Dulong-Petit",
  "note": "aus den Aufgabenblättern (W3 Spezifische Wärme, Nr. 3)",
  "language": "GER",
  "type": 1,
  "default_difficulty": 2,
  "default_points": 0,
  "tags": [
    "dulong-petit",
    "molare wärme",
    "spezifische wärme"
  ],
  "subbranches": [
    "Temperatur & Heat"
  ],
  "youtube": ""
}