{
  "title": "Fallbeschleunigung an verschiedenen Orten",
  "note": "aus den Aufgabenblättern (K3 Freier Fall, Nr. 4; K2 ks, Nr. 3)",
  "language": "GER",
  "type": 1,
  "default_difficulty": 2,
  "default_points": 0,
  "tags": [
    "fallbeschleunigung",
    "formelsammlung",
    "freier fall",
    "gravitation",
    "kinematik"
  ],
  "subbranches": [
    "Kinematics"
  ],
  "youtube": ""
}