{
  "id": 24915,
  "title": "Wurfhöhe und -weite eines Fussballs",
  "note": "aus den Aufgabenblättern (K4 Zusammengesetzte Bewegungen, Nr. 10)",
  "language": "GER",
  "type": 1,
  "default_difficulty": 3,
  "default_points": 0,
  "tags": [
    "schräger wurf",
    "wurfhöhe",
    "wurfweite",
    "überlagerung von bewegungen"
  ],
  "subbranches": [
    "Kinematics",
    "Projectile Motion"
  ],
  "youtube": ""
}