{
  "title": "Abstossung durch eine Feder",
  "note": "aus den Aufgabenblättern (D2 Impuls, Nr. 3; D2 Impuls (2007), Nr. 3)",
  "language": "GER",
  "type": 1,
  "default_difficulty": 2,
  "default_points": 0,
  "tags": [
    "impuls",
    "impulserhaltung",
    "rückstoss"
  ],
  "subbranches": [
    "Momentum"
  ],
  "youtube": ""
}