{
  "id": 24664,
  "title": "Kräfte an einer Zugbrücke",
  "note": "aus den Aufgabenblättern (S1 Drehmoment & Gleichgewicht, Nr. 9; S1_StarrerKörper, Nr. 9)",
  "language": "GER",
  "type": 1,
  "default_difficulty": 3,
  "default_points": 0,
  "tags": [
    "drehmoment",
    "gleichgewicht",
    "kräftegleichgewicht",
    "lagerkraft"
  ],
  "subbranches": [
    "Lever"
  ],
  "youtube": ""
}
